name,gender,follower_count,voteup,cmt_count,content,character_num,emotion1,relief,re1
匿名用户,1,0,13,6,有些偏题了，不过还是想怒答一发：自从钟校长走了之后感觉学校一直在走下坡路，这些是从一点点的细节体现的：比如说管理日趋混乱日趋一刀切；校园环境也有些变差；平白无故搞什么节能，教学楼图书馆水龙头出水还没有我出汗快……这和简单粗暴的不让学生出校门简直一脉相承。金校长麻烦您干点实事吧，管管学生死活。为啥匿名？不匿名分分钟被导员强制删除。,165,0.006565952623846183,有些偏题了，不过还是想怒答一发：自从钟校长走了之后感觉学校一直在走下坡路，这些是从一点点的细节体现的：比如说管理日趋混乱日趋一刀切；校园环境也有些变差；平白无故搞什么节能，教学楼图书馆水龙头出水还没有我出汗快……这和简单粗暴的不让学生出校门简直一脉相承。金校长麻烦您干点实事吧，管管学生死活。为啥匿名？不匿名分分钟被导员强制删除。,0.006565952623846183
匿名用户,1,0,6,2,利益相关：入校天大在校生天大的一系列操作是属实不顾及学生的感受食堂只开两个，每个食堂只开一个门。并且将用餐时间限制在了6：30-7：30、11：30-12：30、17：30-18：30。不仅要排队进食堂，用餐更是又热又挤，加速疫情传播。2. 食堂借疫情期间涨价，菜种类少，难吃暂且不提，一个菜动辄7、8块钱半份，菜量也不大。3. 商店大概就开了2个，买东西要走很远。营业时间短，有效的把学生聚集在一起4. 硕士入学一年多还住在本科生4人寝室，博士住硕士生2人寝室，没有扩招的能力一直扩招。5. 宿舍每月不顾及学生隐私查违禁电器，空调收费昂贵。7.16日租赁空调，被告知用至8月就算一年的租金，这么收费意味着过完这个夏天要交两年的租金。6. 宿舍楼一层上百号学生，淋浴室只开3、4个淋浴间，十点以后大家都从实验室回来，排队洗澡都要十几分钟。水流小暂且不提，一周还要有三四天没热水。7. 网费贵。如果说寝室食堂不好，现在学习都受到制约。平时学生网费2元1g，没有包月套餐，工科做实验下个数据，下个软件，花个四五十块钱都算便宜的。8. 补贴低。工科，硕士生一月也就拿国家500+导师200，入学奖学金别的学校很多都上万，天大2000封顶。,516,7.37854222165879e-13,利益相关：入校天大在校生天大的一系列操作是属实不顾及学生的感受食堂只开两个，每个食堂只开一个门。不仅要排队进食堂，用餐更是又热又挤，加速疫情传播。2. 食堂借疫情期间涨价，菜种类少，难吃暂且不提，一个菜动辄7、8块钱半份，菜量也不大。营业时间短，有效的把学生聚集在一起4. 硕士入学一年多还住在本科生4人寝室，博士住硕士生2人寝室，没有扩招的能力一直扩招。5. 宿舍每月不顾及学生隐私查违禁电器，空调收费昂贵。7.16日租赁空调，被告知用至8月就算一年的租金，这么收费意味着过完这个夏天要交两年的租金。6. 宿舍楼一层上百号学生，淋浴室只开3、4个淋浴间，十点以后大家都从实验室回来，排队洗澡都要十几分钟。平时学生网费2元1g，没有包月套餐，工科做实验下个数据，下个软件，花个四五十块钱都算便宜的。,7.578915273143139e-11
name,gender,follower_count,voteup,cmt_count,content,character_num,emotion1,relief,re1
匿名用户,1,0,15,2,看来就得知乎治校后人称718事变更新更新！课题组师兄已经成功出校为了纪念这一伟大的革命性时刻，课题组师兄弟们已决定晚上出校加餐，用实际行动打压汽修餐厅我觉得下一步天大知乎er可以瞄准学五二楼以及小绿车等无良商家，让它们滚出天大指日可待,117,0.010740179543003103,看来就得知乎治校后人称718事变更新更新！课题组师兄已经成功出校为了纪念这一伟大的革命性时刻，课题组师兄弟们已决定晚上出校加餐，用实际行动打压汽修餐厅我觉得下一步天大知乎er可以瞄准学五二楼以及小绿车等无良商家，让它们滚出天大指日可待,0.010740179543003103
匿名用户,1,0,3,0,看来果然只有985，211的学校才会收到如此关注。我们学校一个双非的，从五月就禁止学生出去，请假流程无比繁琐。奖学金啥啥的问题，跟天津大学一样。懒政，一刀切，人文关怀？？不存在的。只想努力毕业滚蛋，这学校，这老板太恶心人了。,112,0.9972321358552927,看来果然只有985，211的学校才会收到如此关注。我们学校一个双非的，从五月就禁止学生出去，请假流程无比繁琐。奖学金啥啥的问题，跟天津大学一样。懒政，一刀切，人文关怀？？不存在的。只想努力毕业滚蛋，这学校，这老板太恶心人了。,0.9972321358552927
匿名用户,1,0,21,18,作为开学大三的人来说几句，如果能看到这个问题（直接搜搜不到，要切到近一周才行，还有好几个关于天大的问题也是这样才能搜到）奉劝各位高考学子不要报这个学校，这是所唯成绩与科研(特指大创)，论文的学校，你不搞一定程度的科研/竞赛都不能毕业，成绩不好就什么也没有，形式主义问题其他的回答都能看到，而且有能上天大的分北理东南不是更好吗，最后点赞一下批评智算的那个，简直太对了————————————————————————稍微修改一下，学校的整体风气是加权导向的，导致大家普遍追求高加权绩点了，有可能忽略了自己的兴趣与未来规划，最后只是成为大佬的陪跑。成绩只是大学的一个维度，出了大学就一点用都没有了，可惜很多人都很迟才认识到这个问题。何况谁不希望学校好呢，所以才要正视它的问题（形式主义看其他回复是越来越严重了）。另外，所有人必须搞科研竞赛这个是真的ex。————————————————————————再度更新，之前评论区有个人拿小号一直洗，看了看也在其他人的评论区里洗，现在删评了，简单总结下他观点就是认为学校一切为了成绩没问题，而且没能力改变就忍着，还认为是我想争保研名额才在这说的。我这成绩是虽然算是边缘圈，但实际上完全保不上的，差距很大的，而且看其他前辈的评价这研有什么值得的，我考研去个更好的学校专业它不香吗？,557,0.9999999999999991,作为开学大三的人来说几句，如果能看到这个问题（直接搜搜不到，要切到近一周才行，还有好几个关于天大的问题也是这样才能搜到）奉劝各位高考学子不要报这个学校，这是所唯成绩与科研(特指大创)，论文的学校，你不搞一定程度的科研/竞赛都不能毕业，成绩不好就什么也没有，形式主义问题其他的回答都能看到，而且有能上天大的分北理东南不是更好吗，最后点赞一下批评智算的那个，简直太对了————————————————————————稍微修改一下，学校的整体风气是加权导向的，导致大家普遍追求高加权绩点了，有可能忽略了自己的兴趣与未来规划，最后只是成为大佬的陪跑。成绩只是大学的一个维度，出了大学就一点用都没有了，可惜很多人都很迟才认识到这个问题。何况谁不希望学校好呢，所以才要正视它的问题（形式主义看其他回复是越来越严重了）。,0.9999999985057031
匿名用户,1,0,12,1,不患寡而患不均！古人诚不欺我！在天大待了好多年，前面回答里提到的问题大部分都遇到过，已经都见怪不怪了，但是一次又一次的挑战同学们忍耐的底线，造成如今的[招生季劝退]，难道不足以引起反思吗？总结就是，天大的宣传对外不足以引生源，对内不足以平民愤，希望这波舆情事件能够引起重视，做出调整改变。做好了这也是赚口碑的机会好吧？前面还有回答说“学生们不应该这样不懂事地闹”？？？没有谁希望自己的学校以这样的方式登上热搜的啊？大家都想能以天大为荣，只是恨铁不成钢罢了，哪个天大人又不想在外面能骄傲的说出“我是天大的”这句话呢？,257,0.9999362168273944,不患寡而患不均！古人诚不欺我！在天大待了好多年，前面回答里提到的问题大部分都遇到过，已经都见怪不怪了，但是一次又一次的挑战同学们忍耐的底线，造成如今的[招生季劝退]，难道不足以引起反思吗？总结就是，天大的宣传对外不足以引生源，对内不足以平民愤，希望这波舆情事件能够引起重视，做出调整改变。做好了这也是赚口碑的机会好吧？前面还有回答说“学生们不应该这样不懂事地闹”？？？没有谁希望自己的学校以这样的方式登上热搜的啊？大家都想能以天大为荣，只是恨铁不成钢罢了，哪个天大人又不想在外面能骄傲的说出“我是天大的”这句话呢？,0.9999362168273944
Hotaru,1,2009,2,2,希望学校弹性管理，越办越好。,14,0.986673910553149,希望学校弹性管理，越办越好。,0.986673910553149
name,gender,follower_count,voteup,cmt_count,content,character_num,emotion1,relief,re1
匿名用户,1,0,12,2,坐标北洋园。胳膊受伤，伤口大概七厘米，去校医院无法缝合清创，只能紧急止血，申请出校门需要校医院联系保卫处审批，辅导员审批以及领导审批。大概三小时后才得以出校门转院。如果伤口再深一些或者审批再慢一些，可能就不用出学校了。,109,0.9999887206619671,坐标北洋园。胳膊受伤，伤口大概七厘米，去校医院无法缝合清创，只能紧急止血，申请出校门需要校医院联系保卫处审批，辅导员审批以及领导审批。大概三小时后才得以出校门转院。如果伤口再深一些或者审批再慢一些，可能就不用出学校了。,0.9999887206619671
白冰,-1,48,3,0,两个小时后回答，目前已经开始出现大批的洗地党了。说有些人在恶意中伤学校。我认为吧，实事求是。看看同学们说的是不是存在的事实，就可以了。实际存在，那就不是中伤。再说一句，有的学校愿意吃屎，别拉着天大学生一起。——暂时还没返校，因为我是“法学生”（超大声）！！！天大的种种官僚主义和利益集团已经侵蚀了卫津路和北洋园的方方面面，这次“差别对待”只是诸多问题的一次爆发而已。如果学校不能管中窥豹的话，这样的事情会一而再再而三的！就像天大板块的其他问题“天大为什么衰落了？”,232,0.9999999277416124,两个小时后回答，目前已经开始出现大批的洗地党了。说有些人在恶意中伤学校。我认为吧，实事求是。看看同学们说的是不是存在的事实，就可以了。实际存在，那就不是中伤。再说一句，有的学校愿意吃屎，别拉着天大学生一起。——暂时还没返校，因为我是“法学生”（超大声）！！！天大的种种官僚主义和利益集团已经侵蚀了卫津路和北洋园的方方面面，这次“差别对待”只是诸多问题的一次爆发而已。如果学校不能管中窥豹的话，这样的事情会一而再再而三的！就像天大板块的其他问题“天大为什么衰落了？”,0.9999999277416124
孙侠,1,2,12,0,更新：解封了说实话，回来以后退了住宿费，网费也不花钱还是很不错的。就是后勤以及学校某些垄断企业（此处特指九鼎制冷与小绿车）真的拉跨每天已经不用登记体温，各种校外人员随意出入，从北门蹲点一会就可以看到，除了学生所有人都可以进进出出。可能我们学生身上自带病毒吧。总结就是：形式主义,138,0.07720292361092718,更新：解封了说实话，回来以后退了住宿费，网费也不花钱还是很不错的。就是后勤以及学校某些垄断企业（此处特指九鼎制冷与小绿车）真的拉跨每天已经不用登记体温，各种校外人员随意出入，从北门蹲点一会就可以看到，除了学生所有人都可以进进出出。可能我们学生身上自带病毒吧。总结就是：形式主义,0.07720292361092718
公子厚,1,225,3,1,泻药人在家中 刚从天大毕业也不在天大读研 所以不怕被删帖了现在这个问题已经从热搜撤下去了看来学校解决问题的方式还是这样一如既往解决不了就让问题不存在就好了其实形式主义 官僚主义啥的 其他回答已经说的够多了我就说两个实际好了 学校在食堂让控制流量 桌子安装隔板进出食堂戴口罩 实际上迈入大门就可以堂而皇之的摘下了 虽然食堂这么严 但是1895餐吧和留园这些聚餐的地方没有任何限制措施呢大家该吃吃该喝喝 快乐的很第二件事 我室友和我一起到我家旅游 走的那天一起订了一辆商务车 然后这个车居然开进了学校 非常神奇 一问 因为该车跑过几次学校的会议接送 今天又穿的正装 所以保安直接放行了 放行了好啊 我们出去的时候居然连我们的离校申请也没有检查 真是够脸熟的啊所以大家看到没 想出校 租一辆商务车即可,347,0.02015895270438317,泻药人在家中 刚从天大毕业也不在天大读研 所以不怕被删帖了现在这个问题已经从热搜撤下去了看来学校解决问题的方式还是这样一如既往解决不了就让问题不存在就好了其实形式主义 官僚主义啥的 其他回答已经说的够多了我就说两个实际好了 学校在食堂让控制流量 桌子安装隔板进出食堂戴口罩 实际上迈入大门就可以堂而皇之的摘下了 虽然食堂这么严 但是1895餐吧和留园这些聚餐的地方没有任何限制措施呢大家该吃吃该喝喝 快乐的很第二件事 我室友和我一起到我家旅游 走的那天一起订了一辆商务车 然后这个车居然开进了学校 非常神奇 一问 因为该车跑过几次学校的会议接送 今天又穿的正装 所以保安直接放行了 放行了好啊 我们出去的时候居然连我们的离校申请也没有检查 真是够脸熟的啊所以大家看到没 想出校 租一辆商务车即可,0.02015895270438317
匿名用户,1,0,3,0,行，你们的回答我都看了，深得我心。坐等硕士涨工资奖学金全覆盖，最起码解决温饱吧，天老板！还没有管事的看到做出行动的话希望再来一波知乎治校加油 ,71,0.9641206387304347,行，你们的回答我都看了，深得我心。坐等硕士涨工资奖学金全覆盖，最起码解决温饱吧，天老板！还没有管事的看到做出行动的话希望再来一波知乎治校加油 ,0.9641206387304347
name,gender,follower_count,voteup,cmt_count,content,character_num,emotion1,relief,re1
卡通狮子,1,1,3,2,封闭式管理并不是执行能力强，而是执行能力弱，一些自欺欺人和装腔作势的方法根本毫无意义。更有甚者自己滥用公权力不承担责任，但样子都装出是为了学生好，实在令人厌恶。,80,0.555613986430813,封闭式管理并不是执行能力强，而是执行能力弱，一些自欺欺人和装腔作势的方法根本毫无意义。更有甚者自己滥用公权力不承担责任，但样子都装出是为了学生好，实在令人厌恶。,0.555613986430813
匿名用户,1,0,21,0,母校就是一个自己可以在心里骂无数遍，也不允许别人骂一句的地方。感谢兄弟院校们为tju打榜，我们终于向隔壁看齐可以出去了，希望其它兄弟院校们因地制宜，在疫情常态化的当下，制定合理的政策。匿了匿了，心满意足的匿了。————————以下为原答案。懒政，领导推卸责任。教职工子女孩子、辅导员、美发后勤人员均可以随意进出，要是在北门放个录像机可以更加清楚，全学校除了学生以外谁出去都不会感染，嗯就学生出去会有问题。想出去，请假，必须写病假，整个学校走形式，出了问题是你的事情，谁让你当时谎报了呢？反正领导是安全的。好即便是真为了学生着想，现在学校除了本科生研究生博士生均回到学校，比以往任何一个假期都多（之前有回家的，有出去的），结果学校就开两个食堂，每天吃饭爆满？这就不怕人流密集了？进出食堂门还走着形式查体温，扫码？谁有食堂爆满的照片可以发一下。学校还实行暑假模式？所有学生都在校，后勤老师们放假？佩服佩服。隔壁南开7.6号就允许学生凭借学生卡自由出入，但当天必须回，难道是因为南开女生多？天大男生多？？男生事情少皮实？？————-分割线————-补几张张带着孩子欢乐逛校园的图，好欢乐啊，亲子一家亲。（校外人员不戴口罩，学生走哪戴哪）（突然看见宿舍楼上的条幅，莫名的感到讽刺）————-分割线————————我们不是反对疫情期间采取的流动管制，而是反对疫情常态化的当下，不合理的流动管制。反对当下的形式主义，如果学校真的做到位了，我相信根本没有这样的事情发生。————-再分割线————————没想到居然上了热搜，匿了匿了——————在分割—————————感谢各位兄弟院校为tju打榜，终于向隔壁看齐。心愿满足。希望今年报考的学生不要被吓到，母校就是一个自己可以吐槽但是绝不允许别人说坏话的地方，这次也就是暴露出一些学校的问题，但这些问题我相信在全国其他各个高校也都是普遍存在的，天大还是一个值得大家来的地方。,804,0.9999999999862417,母校就是一个自己可以在心里骂无数遍，也不允许别人骂一句的地方。感谢兄弟院校们为tju打榜，我们终于向隔壁看齐可以出去了，希望其它兄弟院校们因地制宜，在疫情常态化的当下，制定合理的政策。教职工子女孩子、辅导员、美发后勤人员均可以随意进出，要是在北门放个录像机可以更加清楚，全学校除了学生以外谁出去都不会感染，嗯就学生出去会有问题。想出去，请假，必须写病假，整个学校走形式，出了问题是你的事情，谁让你当时谎报了呢？好即便是真为了学生着想，现在学校除了本科生研究生博士生均回到学校，比以往任何一个假期都多（之前有回家的，有出去的），结果学校就开两个食堂，每天吃饭爆满？隔壁南开7.6号就允许学生凭借学生卡自由出入，但当天必须回，难道是因为南开女生多？（校外人员不戴口罩，学生走哪戴哪）（突然看见宿舍楼上的条幅，莫名的感到讽刺）————-分割线————————我们不是反对疫情期间采取的流动管制，而是反对疫情常态化的当下，不合理的流动管制。希望今年报考的学生不要被吓到，母校就是一个自己可以吐槽但是绝不允许别人说坏话的地方，这次也就是暴露出一些学校的问题，但这些问题我相信在全国其他各个高校也都是普遍存在的，天大还是一个值得大家来的地方。,0.9999999994641806
一笑了浮生,-1,8,4,0,正常啊，一刀切的行政作风。有一部分是懒政，有一部分是利益。同学们都不出去，校园里面的各种消费场所赚的盆满钵满。教职工当然可以出去了，毕竟是大人。投诉是没用的，现在嘛，都是按闹分配，谁最会闹，谁就有资格被解决问题。同学们使劲闹就完事了，迫于舆论压力，学校领导还是会深明大义的，发几个通告，处理一些不听话的人，事情就过去了。当然该怎么样还是怎么样。,172,0.6112134391571705,正常啊，一刀切的行政作风。有一部分是懒政，有一部分是利益。同学们都不出去，校园里面的各种消费场所赚的盆满钵满。教职工当然可以出去了，毕竟是大人。投诉是没用的，现在嘛，都是按闹分配，谁最会闹，谁就有资格被解决问题。同学们使劲闹就完事了，迫于舆论压力，学校领导还是会深明大义的，发几个通告，处理一些不听话的人，事情就过去了。当然该怎么样还是怎么样。,0.6112134391571705
彼岸听潮,-1,714,9,0,（xx社2020年7月18日电）众所周知，天津大学学子们带有特异性易感体质，而周围教职工阿姨叔叔以及其家属天然具有抗新冠免疫力。自本月开始，天大开始实施严格的学生出入管理制度。这项政策反应了学校对于学生生命安全的高度重视，体现了学校领导坚决领导全体师生打赢这场疫情防控阻击战持久战的坚定决心。与此同时，天大食堂与浴园等处实施紧张管理，部分物价上涨，学校严禁外卖进校，快递也许经过监督处理。这一系列措施也从侧面反应了学校对于留校学子发扬艰苦奋斗精神的殷切期望。据了解，学生进入宿舍等场所时，都需要扫码出入。在管理人员震耳发聩的嗓音的帮助下，学生们如沐春风，深切感受到了管理人员猛烈的口水冲击下的关心和学校无微不至的爱护。反观隔壁南开大学，南开学子可以自由出入学校，对于外卖等的松散化管理等，都体现了隔壁对于疫情防控落实不到位，管理有漏洞的事实。我们也希望南开越来越好，早日成为双一流高校。我们有理由相信，学校必将在艰苦的环境中持续奋斗，为国家和人民做出更大的贡献！,431,1.0,（xx社2020年7月18日电）众所周知，天津大学学子们带有特异性易感体质，而周围教职工阿姨叔叔以及其家属天然具有抗新冠免疫力。自本月开始，天大开始实施严格的学生出入管理制度。这项政策反应了学校对于学生生命安全的高度重视，体现了学校领导坚决领导全体师生打赢这场疫情防控阻击战持久战的坚定决心。与此同时，天大食堂与浴园等处实施紧张管理，部分物价上涨，学校严禁外卖进校，快递也许经过监督处理。这一系列措施也从侧面反应了学校对于留校学子发扬艰苦奋斗精神的殷切期望。反观隔壁南开大学，南开学子可以自由出入学校，对于外卖等的松散化管理等，都体现了隔壁对于疫情防控落实不到位，管理有漏洞的事实。,1.0
真香少年与饭,1,10,2,0,南信大作为全国最早开学的高校，现在也还没解封呢，学生还是不能自由出入。,35,0.8747242532618403,南信大作为全国最早开学的高校，现在也还没解封呢，学生还是不能自由出入。,0.8747242532618403
name,gender,follower_count,voteup,cmt_count,content,character_num,emotion1,relief,re1
心束负,-1,22,2,0,新校区，让你出门你能去干嘛，去南开把妹？,20,0.04366395267143941,新校区，让你出门你能去干嘛，去南开把妹？,0.04366395267143941
