name,gender,follower_count,voteup,cmt_count,content,character_num,emotion1,relief,re1
匿名用户,1,0,5,1,各位新老区大佬别秀了吧，研一小菜鸟，坐标武清前沿院！武清前沿院的情况大家知道肯定知道，不知道的我就不描述了，心酸 ，相比新校区老校区，艰苦得不是一点点，能来这边的人，可以说真的有那么点爱科研了！可惜千辛万苦来到武清，满怀壮志准备吃土，结果被告知，不好意思，不给你吃啦！人爷不伺候了！要想去实验室，请先在宿舍隔离一周，我先不说我和一个每天去实验室的师兄住一块，还能叫自我隔离有多么可笑！所以，我那个师兄是有病毒自防护屏障？其次，天津大学在前沿院是没有宿舍的，所以我们住在武清区的高新公寓这边，和许多公司的许多员工住在一个院子里，他们没有隔离的要求，可以自由进出，我们学生却连出高新公寓院子去买个东西都不行！真真真是可笑之极，我已经越来越忘了我曾经满怀的读博的壮志，这个书，读来何用？？？？？？所以，新老区的各位大佬们，你们已经很幸福了！别抱怨了！不还有我们吗？终日打气，难热雄心！................................分隔线...............................刚才下去散步，园区内办信用卡(没有口罩)都能进来，我们却不能出去，感到一阵恶心 ！形式主义往你脸上拍,505,9.235610664681815e-06,各位新老区大佬别秀了吧，研一小菜鸟，坐标武清前沿院！武清前沿院的情况大家知道肯定知道，不知道的我就不描述了，心酸 ，相比新校区老校区，艰苦得不是一点点，能来这边的人，可以说真的有那么点爱科研了！可惜千辛万苦来到武清，满怀壮志准备吃土，结果被告知，不好意思，不给你吃啦！要想去实验室，请先在宿舍隔离一周，我先不说我和一个每天去实验室的师兄住一块，还能叫自我隔离有多么可笑！所以，我那个师兄是有病毒自防护屏障？其次，天津大学在前沿院是没有宿舍的，所以我们住在武清区的高新公寓这边，和许多公司的许多员工住在一个院子里，他们没有隔离的要求，可以自由进出，我们学生却连出高新公寓院子去买个东西都不行！真真真是可笑之极，我已经越来越忘了我曾经满怀的读博的壮志，这个书，读来何用？？？？？？所以，新老区的各位大佬们，你们已经很幸福了！,0.23166438873802608
匿名用户,1,0,5,8,天大行政是个神奇的地方，亲眼见到我的本科同学，毕业留校到行政，从一个温柔善解人意的姑娘变成了鼻孔朝天对学生说话没有好脸色的老师……大概这就是天大的传统吧，什么人进去都会被同化，拿学生不当人,94,0.9999988218625202,天大行政是个神奇的地方，亲眼见到我的本科同学，毕业留校到行政，从一个温柔善解人意的姑娘变成了鼻孔朝天对学生说话没有好脸色的老师……大概这就是天大的传统吧，什么人进去都会被同化，拿学生不当人,0.9999988218625202
匿名用户,1,0,5,0,希望可以在热榜多待几天告诉告诉大家我们天大究竟是天津哪所大学   ,33,0.4574448128334102,希望可以在热榜多待几天告诉告诉大家我们天大究竟是天津哪所大学   ,0.4574448128334102
匿名用户,1,0,5,0,天大现在这么多学生在校早饭食堂居然只有一个窗口开放，吃个早饭排了半小时   之前在朋友圈分享了知乎这个问题，已经被导员要求删掉了，说是对天大影响不好   ,77,0.006341885729399643,天大现在这么多学生在校早饭食堂居然只有一个窗口开放，吃个早饭排了半小时   之前在朋友圈分享了知乎这个问题，已经被导员要求删掉了，说是对天大影响不好   ,0.006341885729399643
name,gender,follower_count,voteup,cmt_count,content,character_num,emotion1,relief,re1
匿名用户,1,0,5,1,记忆中宁静的大活竟然变成烧烤铺如此资源利用真令人不适干脆一鼓作气响应政策太雷像下北洋亭前摆地摊主楼阶前海棠树下搭小灶红红火火其乐融融真就把务实做到极致了呗,77,0.8575728695068273,记忆中宁静的大活竟然变成烧烤铺如此资源利用真令人不适干脆一鼓作气响应政策太雷像下北洋亭前摆地摊主楼阶前海棠树下搭小灶红红火火其乐融融真就把务实做到极致了呗,0.8575728695068273
匿名用户,1,0,5,3,刚收到通知书的我突然觉得不香了。,16,0.5604110684971241,刚收到通知书的我突然觉得不香了。,0.5604110684971241
匿名用户,1,0,5,8,不会真的有人在你天待了六七年就对学校本身有感情吧，不会吧不会吧？？(可爱的同学和慈祥的老师不算在学校范围内),54,0.9998954505878069,不会真的有人在你天待了六七年就对学校本身有感情吧，不会吧不会吧？？(可爱的同学和慈祥的老师不算在学校范围内),0.9998954505878069
匿名用户,1,0,5,1,"看前边大家吐槽的点挺多的，我来吐槽下空调的问题一年租金335,2年535，9.31-次年8.31算一年，中间无论什么时候续交，都按一年算，8.30号交费，8.31使用一天也给你算一年，呕呕呕，这不合理的规定学校也能放任，空调业务的人后台是有多硬还是红包给的够足啊，学校也真是可以呢，联合商家割学生韭菜。新开的42斋烧烤，奶茶店，汽修餐厅也就不说了",173,0.31238986167997296,"看前边大家吐槽的点挺多的，我来吐槽下空调的问题一年租金335,2年535，9.31-次年8.31算一年，中间无论什么时候续交，都按一年算，8.30号交费，8.31使用一天也给你算一年，呕呕呕，这不合理的规定学校也能放任，空调业务的人后台是有多硬还是红包给的够足啊，学校也真是可以呢，联合商家割学生韭菜。新开的42斋烧烤，奶茶店，汽修餐厅也就不说了",0.31238986167997296
123456,-1,0,5,1,我觉得我们可以联合起来，写一封信，交给教育局领导，甚至法院，退给我们空调租金，这一年下来可不是一小笔钱。有人说会影响招生，我觉得从短时间看是影响招生，更何况我们说的是事实，它活该。从长远来看，对学校来说是好的。,105,0.00955093970456633,我觉得我们可以联合起来，写一封信，交给教育局领导，甚至法院，退给我们空调租金，这一年下来可不是一小笔钱。有人说会影响招生，我觉得从短时间看是影响招生，更何况我们说的是事实，它活该。从长远来看，对学校来说是好的。,0.00955093970456633
name,gender,follower_count,voteup,cmt_count,content,character_num,emotion1,relief,re1
匿名用户,1,0,5,0,人在天大，刚出54教。看着食堂外排队的同学，食堂里依然在排队的同学，拿快递在排队的同学，这种聚集程度真的符合贵校的防疫政策吗？说好的人与人距离一米呢？行，排队就算了，菜又贵又咸，合着涨价是因为多放盐了？男生一顿饭怎么着都得12.3块钱以上，什么？学校有补助？放眼国内各985高校，没有比天大的补助更低的了，奖学金连学费都不能覆盖，真的可笑。然后是超市，现在在天津封建大学里唯一的放松方法就是去操场上打打球跑跑步，又因为实验原因，一般8点多才能去运动，结果累的满头大汗想去超市买水，结果超市8点就关门？还tm方圆2公里内就一个超市？之前第二批返校人少就算了，现在都第三批都回来了还就开一个超市？快递，不想多吐槽了。猎吧真的救我 命。总之天大是真心想让大家多运动，少吃饭，多搞科研，在校内安安全全的度过这下半年，大家不要尬黑哦，学校的宽带现在可是免费的呢。,376,0.2426342681445719,人在天大，刚出54教。看着食堂外排队的同学，食堂里依然在排队的同学，拿快递在排队的同学，这种聚集程度真的符合贵校的防疫政策吗？说好的人与人距离一米呢？行，排队就算了，菜又贵又咸，合着涨价是因为多放盐了？男生一顿饭怎么着都得12.3块钱以上，什么？学校有补助？放眼国内各985高校，没有比天大的补助更低的了，奖学金连学费都不能覆盖，真的可笑。然后是超市，现在在天津封建大学里唯一的放松方法就是去操场上打打球跑跑步，又因为实验原因，一般8点多才能去运动，结果累的满头大汗想去超市买水，结果超市8点就关门？还tm方圆2公里内就一个超市？之前第二批返校人少就算了，现在都第三批都回来了还就开一个超市？快递，不想多吐槽了。猎吧真的救我 命。总之天大是真心想让大家多运动，少吃饭，多搞科研，在校内安安全全的度过这下半年，大家不要尬黑哦，学校的宽带现在可是免费的呢。,0.2426342681445719
匿名用户,1,0,5,0,封校是双向的：学生出不去，想找料的媒体朋友也进不来。学生出不去，养活了食品安全不达标的食堂；媒体朋友进不来，省了多少删帖河蟹的费用。一手多赚钱，一手少赔钱，岂不美哉？各位要记得，谭嗣同先生曾说过：各国变法，无不从流血而成。生存是一切的前提，请诸君提出诉求的时候保护好自己。为了逞一时之快，而因提出诉求而遭到学校的打击报复，是否是值得的？请诸君忍耐，白白牺牲和豁出性命是两回事，学校已经对不满的学生有所动作了。作为学生——完全的待宰羔羊，与学校老爷对抗就是螳臂当车，蜉蚴撼大树。我同诸君一样十分愤怒。各位的心情我能理解，只是对解封的诉求源于一个前提：我是天大人，天大应该做对天大人有利的事。遗憾的是，每个在天大学习过的学生都懂得，天大从没有把学生当人看，学生只是领导升迁的政治资本，是被后勤部门圈钱的韭菜，是学校压榨出研究论文的研畜。这件事上的最上策就是以毕业生的资格永远离开学校，这样一劳永逸，寄人篱下是永远不会有好果子吃的。我们在这件事上能做的事情是有限的，即使要做也最好团结起来，学校整一人易，整十人难！就个人单独行动而言，最安全的就是合理（保命）的发声，借用大刘“三体”里的一句话：呼叫各位未返校的同学，呼叫各位未返校的同学，不要返校，这里不是家！,527,1.0,封校是双向的：学生出不去，想找料的媒体朋友也进不来。学生出不去，养活了食品安全不达标的食堂；媒体朋友进不来，省了多少删帖河蟹的费用。生存是一切的前提，请诸君提出诉求的时候保护好自己。为了逞一时之快，而因提出诉求而遭到学校的打击报复，是否是值得的？请诸君忍耐，白白牺牲和豁出性命是两回事，学校已经对不满的学生有所动作了。作为学生——完全的待宰羔羊，与学校老爷对抗就是螳臂当车，蜉蚴撼大树。遗憾的是，每个在天大学习过的学生都懂得，天大从没有把学生当人看，学生只是领导升迁的政治资本，是被后勤部门圈钱的韭菜，是学校压榨出研究论文的研畜。,0.9999999999988223
匿名用户,1,0,5,0,以及，封校这不仅仅是天大一所学校的问题，希望更多的高校以此为戒，切实考虑学生诉求吧中午看到了跃跃欲试的小伙伴，以及已经出去玩耍的票圈，坐在实验室狭小的工位上，内心并没有什么波澜在天大从本科到现在，对于这个地方，还是有这一种本能的爱护，也相信更多的把这个话题推向热搜的人，也是希望天大可以更好。毕竟作为一所大学，一所包容并济，实事求是的大学，应该有一些以人为本的精神，和适当的人文关怀，而不是一味的欺榨学生。而此次知乎治校也反映出，学生已经不再是那群任人宰割的，合理的诉求终将有可以诉求的地方。希望这是天大改进的开始吧，座谈会，校长信箱，不再论文形式主义的表面工程，而是可以真正听到学生的呼声，切实的解决问题。无论怎样，希望天大，可以更好。从五月初返校至今，地位北洋园校区最初还可以理解为了大家的安全考虑，宿舍隔离也算是人性化，还有防疫物资，一两个月出不去也就忍了。万万没想到，导员当时打电话说的要封闭到寒假，也许可能大概其真的是真的。。。亲历了北门取快递，东南门取快递，保外就医，深刻感觉自己像是蹲了监狱。但是，但是，但是老师随意出入也就算了，子女也可以。校内食堂员工，饭店员工，修手机的，连送水果的都可以自由出入了，然后送药品不行，修仪器不行，学生就依然只能困在校内。就医最初还只是申请即可现在出了校门就要重新申请返津真的是对这迷幻操作无力吐槽匿了匿了,577,0.9999999999999998,以及，封校这不仅仅是天大一所学校的问题，希望更多的高校以此为戒，切实考虑学生诉求吧中午看到了跃跃欲试的小伙伴，以及已经出去玩耍的票圈，坐在实验室狭小的工位上，内心并没有什么波澜在天大从本科到现在，对于这个地方，还是有这一种本能的爱护，也相信更多的把这个话题推向热搜的人，也是希望天大可以更好。毕竟作为一所大学，一所包容并济，实事求是的大学，应该有一些以人为本的精神，和适当的人文关怀，而不是一味的欺榨学生。而此次知乎治校也反映出，学生已经不再是那群任人宰割的，合理的诉求终将有可以诉求的地方。希望这是天大改进的开始吧，座谈会，校长信箱，不再论文形式主义的表面工程，而是可以真正听到学生的呼声，切实的解决问题。无论怎样，希望天大，可以更好。,0.9999999999999976
匿名用户,1,0,5,0,天大是个好学校，让你在学校的时候就能感受到什么是社会的毒打，增强抗击打能力。别的不多说，从财务部报账这个就能看出天大的牛逼之处。申请的时候痛痛快快的给盖章，等到报账的时候把拖字诀和踢皮球的那一套万分那叫一个666啊。愣是可以拖到超出报账时间，省下一大笔支出，咱也不知道是领导吃吃喝喝了还是钱都去哪了。社团报账是真滴难，有些社团办活动不仅活动的经费不给报，还得社团自己往里搭钱。净搞一些没用的形式主义，实事不办。不让学生出校就能防住疫情了？那每天在学校看到那些明显不是教职工也不是学生的都是怎么进来的呢？甚至还有七八岁的小孩？反正就学生嘛，不愿意在天大待着您退学啊，天大又不缺学生，每年那么多想来天大还来不了的呢。所以说，天大不缺学生，学生在领导眼里可能都不算人，只是给学校交学费，在学校消费，带动学校赚钱的提款机而已。你说你就一提款机能不能认清自己，老想着往外跑有用吗？就天大牛逼就完了。,394,0.26123325679502407,天大是个好学校，让你在学校的时候就能感受到什么是社会的毒打，增强抗击打能力。别的不多说，从财务部报账这个就能看出天大的牛逼之处。申请的时候痛痛快快的给盖章，等到报账的时候把拖字诀和踢皮球的那一套万分那叫一个666啊。愣是可以拖到超出报账时间，省下一大笔支出，咱也不知道是领导吃吃喝喝了还是钱都去哪了。社团报账是真滴难，有些社团办活动不仅活动的经费不给报，还得社团自己往里搭钱。净搞一些没用的形式主义，实事不办。不让学生出校就能防住疫情了？那每天在学校看到那些明显不是教职工也不是学生的都是怎么进来的呢？甚至还有七八岁的小孩？反正就学生嘛，不愿意在天大待着您退学啊，天大又不缺学生，每年那么多想来天大还来不了的呢。所以说，天大不缺学生，学生在领导眼里可能都不算人，只是给学校交学费，在学校消费，带动学校赚钱的提款机而已。你说你就一提款机能不能认清自己，老想着往外跑有用吗？就天大牛逼就完了。,0.26123325679502407
匿名用户,1,0,5,0,别的不说，就说为了防止聚集居然把宿舍大部分水龙头和洗澡的喷头卸了，不知道这是什么神仙操作，宿舍里大家都住在一起了，这么干有什么意义吗，在我看来除了给大家造成不便之外没有任何意义，顺便一提，学校面对学生的诉求居然第一反应是控制学生的言论，还站在道德的制高点来谴责学生，真就看学生老实好欺负呗，我只想说天大天大，天大的事都能压下来！,164,0.22560415642100828,别的不说，就说为了防止聚集居然把宿舍大部分水龙头和洗澡的喷头卸了，不知道这是什么神仙操作，宿舍里大家都住在一起了，这么干有什么意义吗，在我看来除了给大家造成不便之外没有任何意义，顺便一提，学校面对学生的诉求居然第一反应是控制学生的言论，还站在道德的制高点来谴责学生，真就看学生老实好欺负呗，我只想说天大天大，天大的事都能压下来！,0.22560415642100828
name,gender,follower_count,voteup,cmt_count,content,character_num,emotion1,relief,re1
匿名用户,1,0,5,0,我想说的大家都说了，只提醒一点，记得匿名，如果要发朋友圈请屏蔽一切老师，因为你永远不知道辅导员什么时候会发起约谈,56,0.3244545614327642,我想说的大家都说了，只提醒一点，记得匿名，如果要发朋友圈请屏蔽一切老师，因为你永远不知道辅导员什么时候会发起约谈,0.3244545614327642
Arjen robben,-1,0,5,0,不匿，点艹管理与经济学部，人在北京，被叫停返校，所有手续需要同学委托，行李需要也需要委托，本来说的毕业登记表学校统一邮寄给同学，结果白痴辅导员最后一刻改成委托同学，行李也被迫扔了好多。核酸检测只有返校了的人可以报销，人在北京做了核酸都算活该。忍了这个学校四年，保研去了北理工，再也不见，手动微笑,147,0.9999734858627807,不匿，点艹管理与经济学部，人在北京，被叫停返校，所有手续需要同学委托，行李需要也需要委托，本来说的毕业登记表学校统一邮寄给同学，结果白痴辅导员最后一刻改成委托同学，行李也被迫扔了好多。核酸检测只有返校了的人可以报销，人在北京做了核酸都算活该。忍了这个学校四年，保研去了北理工，再也不见，手动微笑,0.9999734858627807
匿名用户,1,0,5,3,隔壁的人表示，只要愿意，五月份的时候就可以自由出入。别问，问就是有小道。其实我们一个月前也是这样，不让学生自由出入，教职工随意出入，当时我们还嘲讽校门是半透膜。不过那个时候很多人知道小道的位置，我甚至见过实验室整个课题组排队走小路。学校也知道但不管，所以我也没太大怨气。就当学校在搞面子工程，说了声“辣鸡学校”，也就这样了。个人感觉天大学生如此愤怒，可能是因为找不到小路？其实我有些希望这样的管理能成以后的日常，自从二道岗哨发挥作用后，学校里少了很多奇奇怪怪的人和车。毕竟车走不了那几条小路。最后，祝天大的学生能早日自行出入。毕竟我也经常在天大乱逛，毕业之前一直想去天大拍几张毕业照，最后也没拍成，蛮遗憾的。,304,0.9999999944212159,隔壁的人表示，只要愿意，五月份的时候就可以自由出入。别问，问就是有小道。其实我们一个月前也是这样，不让学生自由出入，教职工随意出入，当时我们还嘲讽校门是半透膜。不过那个时候很多人知道小道的位置，我甚至见过实验室整个课题组排队走小路。学校也知道但不管，所以我也没太大怨气。就当学校在搞面子工程，说了声“辣鸡学校”，也就这样了。个人感觉天大学生如此愤怒，可能是因为找不到小路？其实我有些希望这样的管理能成以后的日常，自从二道岗哨发挥作用后，学校里少了很多奇奇怪怪的人和车。毕竟车走不了那几条小路。最后，祝天大的学生能早日自行出入。毕竟我也经常在天大乱逛，毕业之前一直想去天大拍几张毕业照，最后也没拍成，蛮遗憾的。,0.9999999944212159
匿名用户,1,0,5,0,没返校之前食堂都在做饭给谁吃呢？学生返校了你特么食堂放暑假了？隔壁南开7.6可以出校了，好好学学啊。7.15返校的除了重点地区的都没做核酸检测就回来了，还封校有什么弔意义？,86,0.44726673859884525,没返校之前食堂都在做饭给谁吃呢？学生返校了你特么食堂放暑假了？隔壁南开7.6可以出校了，好好学学啊。7.15返校的除了重点地区的都没做核酸检测就回来了，还封校有什么弔意义？,0.44726673859884525
匿名用户,1,0,5,0,这些操作让人不想在校也无法爱校还有一年半就能逃离这个学校了只想对学弟学妹们说一句隔壁不香吗,45,0.8805530092838393,这些操作让人不想在校也无法爱校还有一年半就能逃离这个学校了只想对学弟学妹们说一句隔壁不香吗,0.8805530092838393
name,gender,follower_count,voteup,cmt_count,content,character_num,emotion1,relief,re1
我是谁我在哪儿,-1,0,5,0,本来好不容易在巨大的科研压力和校园施工噪音下养成了早睡的习惯 结果今天看到这个帖子又很难入睡了。我是为什么来了天大，我是为什么一步步对这个学校极其失望，也许，是看到这个学校对学生没有一丝丝的关怀吧，看到的只是烂到骨子里的形式主义。同学有可爱的，老师有可爱的，工作人员有可爱的，校领导有可爱的。那问题出在哪里呢？——————分割线——————这个世界会因为一小部分人而美好，也会因为一小部分人而腐烂。(这个世界没有鲁迅了),210,0.9999999751301427,本来好不容易在巨大的科研压力和校园施工噪音下养成了早睡的习惯 结果今天看到这个帖子又很难入睡了。我是为什么来了天大，我是为什么一步步对这个学校极其失望，也许，是看到这个学校对学生没有一丝丝的关怀吧，看到的只是烂到骨子里的形式主义。同学有可爱的，老师有可爱的，工作人员有可爱的，校领导有可爱的。那问题出在哪里呢？——————分割线——————这个世界会因为一小部分人而美好，也会因为一小部分人而腐烂。(这个世界没有鲁迅了),0.9999999751301427
匿名用户,1,0,5,0,天大的常规操作了。懒，怕担责任，就一刀切。真的感觉天大官僚主义很严重。报个账能气死你。就连艺术团管钥匙的大爷都能看心情对你冷嘲热讽，吹胡子瞪眼。有时候学生和下等人一样。如果这个封闭政策不变的话，那我就一直不返校。我结婚了，在离学校很近的地方租了房子，还养了两只狗。凭什么强迫我住宿舍，限制我人身自由？？,151,0.21814090128107044,天大的常规操作了。懒，怕担责任，就一刀切。真的感觉天大官僚主义很严重。报个账能气死你。就连艺术团管钥匙的大爷都能看心情对你冷嘲热讽，吹胡子瞪眼。有时候学生和下等人一样。如果这个封闭政策不变的话，那我就一直不返校。我结婚了，在离学校很近的地方租了房子，还养了两只狗。凭什么强迫我住宿舍，限制我人身自由？？,0.21814090128107044
匿名用户,1,0,5,1,我就想问问，这防疫都已经到封校的地步了，在大学生活动中心开了个串吧是个什么意思?咋的，吃这家的烧烤也能防疫?,54,0.13769659526678812,我就想问问，这防疫都已经到封校的地步了，在大学生活动中心开了个串吧是个什么意思?咋的，吃这家的烧烤也能防疫?,0.13769659526678812
