name,gender,follower_count,voteup,cmt_count,content,character_num,emotion1,relief,re1
匿名用户,1,0,1,0,不请自来 小怂包选择匿名自我介绍一下 新校区在读本科生很少刷知乎也是第一次写回答，在今天这个热搜帖子下蹲了一天，看了很多很多条回答，无一例外全是黑，所以一度怀疑是自己的立场出现了问题，直到今天和已经返校的朋友探讨并且得到了认同，才敢来发帖。先就我看到的几点，驳斥一下：有帖子说“学弟学妹们多考几分吧不要来天大了”，的确天津大学在其他城市可能的确不出名，属于中流985，但是在天津当地，天大和南开的知名度不容小觑，作为天津本地人，天大是梦校，多考几分我也会选择来天大，而且至今来看并不后悔。现阶段正值高考出分报志愿的时期，因为这个热搜天大招不到好的声源、分数线下降、学校排名下降，对在读生有害无利。所谓“天南大”嘛，隔壁南开自然是比较对象，但是据我南开的朋友所说，南开并没有组织七月份的自愿返校，所以在我和ta说了天大的这个自愿返校制度之后，ta还夸赞了天大的人性化。人就是这样，得不到的就是最好的，每个学校都有它做的不好的地方，作为外人就只能看到他们好的那一面然后与之比较，心生嫉妒。“六月份毕业生返校不能出校”，首先作为天津本地人，我对天津的疫情有着真切的了解，的确基本没有新增数据，但是天津处于首都北京的旁边，这么多年大事小事都是听从北京指挥，更何况北京在六月份时出现了疫情高峰，京津冀一体化天津更是会严加管理。其次据我所知，五六月份天津的高校返校都是封闭管理的，这些高校的老师也同样是照常上下班回家的，教职工属于员工上班，没有哪个单位是把员工封闭管理的，所以教职工和学生区别对待在我看来也在情理之中。关于形式主义的各处扫码测温，我想说天津现在的所有封闭场所进入都是需要扫码测温的，而且就是在走形式的测温，也会出现温度计没显示这种情况，但是形式必须得走，这点天津的百姓也在吐槽，但是没有办法，是规定，天大在天津自然要遵守天津的规定。这次天大确实在管理上出了问题，现阶段疫情没这么严重，邻校也已经放宽了出校政策那天大确实可以有所改进，以及我看到有在说入校之后看病难、学院包庇返校通知的情况，确实需要整治。但是我想说，每个学校都会有它做的不好的地方，但知乎治校duck不必，用今天和室友讨论时ta说的一句话“就像是你爸妈吵架了你会去外面大声嚷嚷吗”。天大的水果节、物价补贴，那个时候pyq都在宣扬自己的学校多么好，也是“别人家的大学”了，而现在呢，清一色的不满，甚至已经不仅仅是对此次疫情期返校制度的不满了，开始上升到其他层面的事情。以上，仅代表个人看法，天大加油！,1033,0.9982815606132253,不请自来 小怂包选择匿名自我介绍一下 新校区在读本科生很少刷知乎也是第一次写回答，在今天这个热搜帖子下蹲了一天，看了很多很多条回答，无一例外全是黑，所以一度怀疑是自己的立场出现了问题，直到今天和已经返校的朋友探讨并且得到了认同，才敢来发帖。先就我看到的几点，驳斥一下：有帖子说“学弟学妹们多考几分吧不要来天大了”，的确天津大学在其他城市可能的确不出名，属于中流985，但是在天津当地，天大和南开的知名度不容小觑，作为天津本地人，天大是梦校，多考几分我也会选择来天大，而且至今来看并不后悔。“六月份毕业生返校不能出校”，首先作为天津本地人，我对天津的疫情有着真切的了解，的确基本没有新增数据，但是天津处于首都北京的旁边，这么多年大事小事都是听从北京指挥，更何况北京在六月份时出现了疫情高峰，京津冀一体化天津更是会严加管理。,1.9340297839898213e-06
匿名用户,1,0,1,0,师大学生赶来慰问。几个月前我们强制开学的时候也是这个情景，非毕业班明明没有课还强制回校封闭管理，毕业班反而没人回来，就很绝。只能祝福了，调整心态，错峰吃饭，好好睡觉。,83,0.9997858569609503,师大学生赶来慰问。几个月前我们强制开学的时候也是这个情景，非毕业班明明没有课还强制回校封闭管理，毕业班反而没人回来，就很绝。只能祝福了，调整心态，错峰吃饭，好好睡觉。,0.9997858569609503
scofield,-1,0,1,0,作为毕业多年的校友，再又一次看到这样的新闻让天大上热搜时，只能留言送他更进一步了，醒醒吧！,45,0.13428075687902363,作为毕业多年的校友，再又一次看到这样的新闻让天大上热搜时，只能留言送他更进一步了，醒醒吧！,0.13428075687902363
匿名用户,1,0,1,3,20级硕士新生，今天上午刚拿到录入通知书，下午就上热搜，这……,31,0.826712432392374,20级硕士新生，今天上午刚拿到录入通知书，下午就上热搜，这……,0.826712432392374
name,gender,follower_count,voteup,cmt_count,content,character_num,emotion1,relief,re1
阿林,-1,6,1,0,山大青岛校区也出不去，管理人员的谨慎一脉相承。,23,0.8967495472858685,山大青岛校区也出不去，管理人员的谨慎一脉相承。,0.8967495472858685
HotFrom,-1,9,1,0,原来别的大学都可以随意进出了嘛！！我们连校外的都不让进啊！,29,0.5357221008699355,原来别的大学都可以随意进出了嘛！！我们连校外的都不让进啊！,0.5357221008699355
匿名用户,1,0,1,0,我以为都是这样，山东某985也这样,17,0.8118149718782621,我以为都是这样，山东某985也这样,0.8118149718782621
匿名用户,1,0,1,0,在校学生，新校区，匿了，不想被毕业。从5号回来一直封校，首先做615到北门，拿着行李箱到东南门，估计5公里吧，确实锻炼身体，得道升仙。后来快递，中通好像是，排队至少半小时，幸运的是每次我都不是（备注中通倒闭了，不要发中通）。取快递的时候看到一外国人，不带口罩？？？只有中国人才能戴口罩吗，这么大的福利？？？再有就是食堂了，菜是老样子，价格至少翻一倍，俩菜12元？？？活不下去了，还贼难吃。最坑的图书馆，刚来了一批学生，学习热情空前高涨，导致二楼一桌四个人，没错，面对面，脚对脚，就差嘴了。这是疫情期间？？？三楼写着未开空调和灯，劝学生去一二楼。学生很听话，好学生，必须赞，二楼都人肉味了，只能说学生太爱学习了。再有就是封校事情了，除了学生都能随便出入，只要扫个码就能进，扫个码就能检测出 我没病毒了？天大的二维码厉害，真希望我也能扫（骚）一下。不好意思打错了。,380,0.00015606748305840856,在校学生，新校区，匿了，不想被毕业。从5号回来一直封校，首先做615到北门，拿着行李箱到东南门，估计5公里吧，确实锻炼身体，得道升仙。后来快递，中通好像是，排队至少半小时，幸运的是每次我都不是（备注中通倒闭了，不要发中通）。取快递的时候看到一外国人，不带口罩？？？只有中国人才能戴口罩吗，这么大的福利？？？再有就是食堂了，菜是老样子，价格至少翻一倍，俩菜12元？？？活不下去了，还贼难吃。最坑的图书馆，刚来了一批学生，学习热情空前高涨，导致二楼一桌四个人，没错，面对面，脚对脚，就差嘴了。这是疫情期间？？？三楼写着未开空调和灯，劝学生去一二楼。学生很听话，好学生，必须赞，二楼都人肉味了，只能说学生太爱学习了。再有就是封校事情了，除了学生都能随便出入，只要扫个码就能进，扫个码就能检测出 我没病毒了？天大的二维码厉害，真希望我也能扫（骚）一下。不好意思打错了。,0.00015606748305840856
匿名用户,1,0,1,0,很多大学依旧封闭吧……说是可以请假出去，至于这个假好不好请……各个高校都解决一下好不好？呵呵呵呵学生都易感吧可能,56,0.9782134067248045,很多大学依旧封闭吧……说是可以请假出去，至于这个假好不好请……各个高校都解决一下好不好？呵呵呵呵学生都易感吧可能,0.9782134067248045
name,gender,follower_count,voteup,cmt_count,content,character_num,emotion1,relief,re1
迷妹,0,2,1,0,啥 ？天大不让出校？作为旁边的中医药大学残存心疼你们，我们一直挺自由的 ,36,0.9987262070366937,啥 ？天大不让出校？作为旁边的中医药大学残存心疼你们，我们一直挺自由的 ,0.9987262070366937
匿名用户,1,0,1,2,还有一个问题是有跨校区需求的难道不做实验了？？？有这种需求的硕士博士也很多人吧,39,0.9695060037271976,还有一个问题是有跨校区需求的难道不做实验了？？？有这种需求的硕士博士也很多人吧,0.9695060037271976
明天你好,-1,0,1,2,坐标重庆，西南大学，从5月20号返校一直封闭管理，除了学生，其他人员都可以自由出入，请假还得经过层层审批，国务院六月份发文，低风险地区解除不合理限制，不知道什么才算不合理限制，也不知道究竟限制的是谁,99,0.861478075989855,坐标重庆，西南大学，从5月20号返校一直封闭管理，除了学生，其他人员都可以自由出入，请假还得经过层层审批，国务院六月份发文，低风险地区解除不合理限制，不知道什么才算不合理限制，也不知道究竟限制的是谁,0.861478075989855
七月,0,5,1,0,热度涨的这么快，正常吗？正在招生的关键期，大家理性点,26,0.9931617469387877,热度涨的这么快，正常吗？正在招生的关键期，大家理性点,0.9931617469387877
匿名用户,1,0,1,0,2016年，有幸参加了学校组织的新生代表交流会，近距离见到了学校的很多领导。每个新生代表都有发言的机会，我给学校提的意见是延长公交车运营时间，末班车定在八点半，对于找工作或者出去聚会的学生实在是太早了，负责的老师回复会和公交集团沟通。我想这个问题应该是新校区大多数学生的心声，然而这个问题至今还没有得到解决。,154,0.9999999371986477,2016年，有幸参加了学校组织的新生代表交流会，近距离见到了学校的很多领导。每个新生代表都有发言的机会，我给学校提的意见是延长公交车运营时间，末班车定在八点半，对于找工作或者出去聚会的学生实在是太早了，负责的老师回复会和公交集团沟通。我想这个问题应该是新校区大多数学生的心声，然而这个问题至今还没有得到解决。,0.9999999371986477
name,gender,follower_count,voteup,cmt_count,content,character_num,emotion1,relief,re1
你几岁阿,0,1,1,0,我们学校开学了也不准出去 已经快两个月了没出过校门  并且食堂也不准吃饭 只能打饭了带走  ,46,0.7039646290484957,我们学校开学了也不准出去 已经快两个月了没出过校门  并且食堂也不准吃饭 只能打饭了带走  ,0.7039646290484957
舒尧的zhihu,1,0,1,0,16级，新校区刚毕业。6.22返校，7.3离校。几乎看了所有的答案，其实对热搜还挺意外的。希望校方直面问题，重视问题，改善管理体系！特别理解现在还在学校同学的感受，如果严格按照学校的标准，可能已经两个多月没出来了。。。刚刚返校的时候发现宿舍洗漱间一半的水龙头 被拆下来就纳闷，感觉过分了呀，后期安装会很麻烦。食堂餐饮质量堪忧，我在校的那段时间，学一人还不是特别多，所以扫码、一人一桌制度执行的还算不错。但最后几天开放了二楼的烧烤，加上留园餐厅二楼一直可以聚餐，这..这不就矛盾了吗？实事求是。这方面学校做的确实不好。改，必须改。四年本科时光匆匆，希望母校越来越好！,282,0.9999999989006605,16级，新校区刚毕业。6.22返校，7.3离校。几乎看了所有的答案，其实对热搜还挺意外的。希望校方直面问题，重视问题，改善管理体系！特别理解现在还在学校同学的感受，如果严格按照学校的标准，可能已经两个多月没出来了。。。刚刚返校的时候发现宿舍洗漱间一半的水龙头 被拆下来就纳闷，感觉过分了呀，后期安装会很麻烦。食堂餐饮质量堪忧，我在校的那段时间，学一人还不是特别多，所以扫码、一人一桌制度执行的还算不错。但最后几天开放了二楼的烧烤，加上留园餐厅二楼一直可以聚餐，这..这不就矛盾了吗？实事求是。这方面学校做的确实不好。改，必须改。四年本科时光匆匆，希望母校越来越好！,0.9999999989006605
匿名用户,1,0,1,0,亲眼见证这个问题从榜三升到榜二，也看了许多回答，虽然我不是天大的，但有很多感同身受的地方。从四月末开学，家长不让进校，私家车不让停留，行李从校门口推到宿舍楼下，一个人来来回回拎上楼，我都忍了。后来发现出门真的很难，食堂的人快递站的人都可以进进出出，甚至总能看到小孩跑来跑去玩，心里真的很难过，只有住校生不能出校门，被限制得死死的。有的人爱玩直接翻墙出去玩，我们胆小怕被抓只呆在宿舍里。过了将近两个月，实在受不了了，借口有事申请了出门，到了外面却感到陌生害怕，竟然想要跑回学校不出来。每天都要填今日校园，后来还搞了什么晚点签到，跟看贼似的，不少同学反应定位不了，学校也没有什么解决方法。可笑的是宿管还是查房。我们学校女生多，又是偏文，敢于发声的人实在太少，我敬佩天津大学同学们的勇气，既然我不能有力地发声，希望你们能改善一些对学校不满的地方。为你们贡献一点微不足道的热度吧。加油。,389,0.9986806178783387,亲眼见证这个问题从榜三升到榜二，也看了许多回答，虽然我不是天大的，但有很多感同身受的地方。从四月末开学，家长不让进校，私家车不让停留，行李从校门口推到宿舍楼下，一个人来来回回拎上楼，我都忍了。后来发现出门真的很难，食堂的人快递站的人都可以进进出出，甚至总能看到小孩跑来跑去玩，心里真的很难过，只有住校生不能出校门，被限制得死死的。有的人爱玩直接翻墙出去玩，我们胆小怕被抓只呆在宿舍里。过了将近两个月，实在受不了了，借口有事申请了出门，到了外面却感到陌生害怕，竟然想要跑回学校不出来。每天都要填今日校园，后来还搞了什么晚点签到，跟看贼似的，不少同学反应定位不了，学校也没有什么解决方法。可笑的是宿管还是查房。我们学校女生多，又是偏文，敢于发声的人实在太少，我敬佩天津大学同学们的勇气，既然我不能有力地发声，希望你们能改善一些对学校不满的地方。为你们贡献一点微不足道的热度吧。加油。,0.9986806178783387
梦想形作家,-1,216,1,0,啧～现在上个学跟坐牢一样,12,0.7957383824005542,啧～现在上个学跟坐牢一样,0.7957383824005542
匿名用户,1,0,1,0,自从龚克校长去了南开。,11,0.8550109640979235,自从龚克校长去了南开。,0.8550109640979235
name,gender,follower_count,voteup,cmt_count,content,character_num,emotion1,relief,re1
匿名用户,1,0,1,6,天呐。我还没入学！！！希望入学之后能解封不能阻碍我脱单的脚步啊……,33,0.9886399686559464,天呐。我还没入学！！！希望入学之后能解封不能阻碍我脱单的脚步啊……,0.9886399686559464
铜铝锂,-1,1,1,0,为了控制疫情，减少人员流动，封闭管理，没有问题，但是也太双标了吧？只有学生不能出门，其他人太随便了，既然其他人可以，学生为什么不可以？！！！,70,0.0011950984052222502,为了控制疫情，减少人员流动，封闭管理，没有问题，但是也太双标了吧？只有学生不能出门，其他人太随便了，既然其他人可以，学生为什么不可以？！！！,0.0011950984052222502
激情小辣椒,-1,382,1,0,当年那个甲流还是什么流感我们也封校。后来是晚自习后翻墙去药店蚂蚁搬家买了绷带和拐杖，一瘸一拐和门卫说去医院换药。就这样弄到了11月底解禁。中间还用红药水涂手上几个人一起风风火火冲出校门。妈蛋门卫太负责，帮我们打车，平白浪费8块钱。,115,1.0038444623328147e-06,当年那个甲流还是什么流感我们也封校。后来是晚自习后翻墙去药店蚂蚁搬家买了绷带和拐杖，一瘸一拐和门卫说去医院换药。就这样弄到了11月底解禁。中间还用红药水涂手上几个人一起风风火火冲出校门。妈蛋门卫太负责，帮我们打车，平白浪费8块钱。,1.0038444623328147e-06
青山揽流萤,-1,0,1,1,        我就问你们想出去干什么？要造反吗？身为天大学子，你们不思醉心学业、报效国家，反而为了一时的自由搁这儿吵吵闹闹，简直有失天大人的风范，我为你们感到羞愧。南开解除了门禁那又怎样，天大作为中国第一所现代大学，自有其精神，自成其品格，何须向南开看齐？        再说校门虽关闭，但网络未关闭，你们可以尽情在网络的世界里遨游，多看看文献，多掌握些先进知识，方能在社会主义现代化强国的建设中贡献自己的力量，方能展现天大人的担当。        领导，我可以出去了吗？,237,0.9999999999228912,        我就问你们想出去干什么？要造反吗？身为天大学子，你们不思醉心学业、报效国家，反而为了一时的自由搁这儿吵吵闹闹，简直有失天大人的风范，我为你们感到羞愧。南开解除了门禁那又怎样，天大作为中国第一所现代大学，自有其精神，自成其品格，何须向南开看齐？        再说校门虽关闭，但网络未关闭，你们可以尽情在网络的世界里遨游，多看看文献，多掌握些先进知识，方能在社会主义现代化强国的建设中贡献自己的力量，方能展现天大人的担当。        领导，我可以出去了吗？,0.9999999999228912
匿名用户,1,0,1,0,谢邀。为什么不让学生出校门？因为要让学生们好好享受，不仅需要交押金还要按年交租金，还要单独交电费的空调呀~（就算只用一个月也要按一年来交的那种哦，一年几百元租金不能浪费啊）因为要让学生们好好体验两个食堂，永恒菜色，到点关门，错过饿着，门口排队刷卡的魅力~（好办法，时刻提醒学生们要有严格的时间观念啊）因为要让学生们好好使用没有浴室的宿舍，完美保留夏日蝉鸣中，汗水的印记~（让我们跨越半个校园，预约去洗澡，再带着一层汗水回来呀）因为要让学生们拥有跨越半个校园去超市的体验，感受在坐满了人，没有空间隔阂的校内烧烤店里，等三个小时终于享用到非食堂的食物时，那份来之不易~ （你说物价？在此地，故有此价）因为要让学生们体会一下在门口，隔着栅栏拿快递，隔着栅栏拿外卖，隔着栅栏和朋友对话的美妙~（这种形式，嗯，就是美妙）想出去嘛？微笑。听着几个楼的装修声，看着来回进出校园的装修人员们，先做个梦吧~,394,0.9999999999186062,谢邀。为什么不让学生出校门？因为要让学生们好好享受，不仅需要交押金还要按年交租金，还要单独交电费的空调呀~（就算只用一个月也要按一年来交的那种哦，一年几百元租金不能浪费啊）因为要让学生们好好体验两个食堂，永恒菜色，到点关门，错过饿着，门口排队刷卡的魅力~（好办法，时刻提醒学生们要有严格的时间观念啊）因为要让学生们好好使用没有浴室的宿舍，完美保留夏日蝉鸣中，汗水的印记~（让我们跨越半个校园，预约去洗澡，再带着一层汗水回来呀）因为要让学生们拥有跨越半个校园去超市的体验，感受在坐满了人，没有空间隔阂的校内烧烤店里，等三个小时终于享用到非食堂的食物时，那份来之不易~ （你说物价？在此地，故有此价）因为要让学生们体会一下在门口，隔着栅栏拿快递，隔着栅栏拿外卖，隔着栅栏和朋友对话的美妙~（这种形式，嗯，就是美妙）想出去嘛？微笑。听着几个楼的装修声，看着来回进出校园的装修人员们，先做个梦吧~,0.9999999999186062
name,gender,follower_count,voteup,cmt_count,content,character_num,emotion1,relief,re1
匿名用户,1,0,1,1,和大家听听歌曲，聊聊天,11,0.9289231725471855,和大家听听歌曲，聊聊天,0.9289231725471855
黑白,-1,10,1,1,学校为了你们的安全不让你们出去，完全是从大局出发，从理性出发，从事实出发。你们居然还在这埋怨学校。你们要在这样下去，学校可就要让你们留级了啊！,71,0.9999976788122025,学校为了你们的安全不让你们出去，完全是从大局出发，从理性出发，从事实出发。你们居然还在这埋怨学校。你们要在这样下去，学校可就要让你们留级了啊！,0.9999976788122025
物理橙v小锅,1,5,1,0,很多学校都不让学生出校门，为什么？大学生是易感染人群吗？,28,0.999388469302091,很多学校都不让学生出校门，为什么？大学生是易感染人群吗？,0.999388469302091
匿名用户,1,0,1,0,"当天出入学校已经可以自动办结了啦！大家自由啦！知乎治校指日可待，上热搜之前无领导关心，出现申请石沉大海，上热搜之后连夜改政策…… 知乎人人都可发声(匿名便可回答)，社会普遍参与，倒逼学校重视。建议以此制度取代学代会，只是辛苦了app开发人员连夜改程序 原回答：看到呆了6年的母校又双叒上了热搜，我……十分的欣慰 又有人关注她了题归正转，以后谁要再敢说工科院校缺乏人文关怀，老子就……就以天大为例狠狠赞同TA 举个栗子：我们实验室在北洋科学楼，因学院和物业协商不一致，物业拒绝给3楼以上供水，就是那种洗个手上个厕所得跑一楼那种。我们辛辛苦苦从一楼打水到实验室搞卫生，脏水还不能从下水道倒……因为楼下的水管破了……我们让他们叫物业来修。过了一周多，我们以为楼下怎么着也得修好了吧，就把涮完抹布的水往下倒，你猜怎么着，楼下又找上来了……在这里为中航物业点个大大的赞，让我们既不能接水又不能倒水再举个栗子：一次去学五食堂吃饭，门口例常扫码给大爷看。那次是门口一个大爷，往里走两步又一个大爷，我扫完给第一个大爷看完后直接往里走，谁知道直接被第二个大爷一把拽住说我没扫码，对，就是直接上手拽那种，直接给我拽懵了……卧槽多少年没这么被人拽了，还以为有人要跟我干仗呢。气的想骂人……唉，作为我的母校，我不应该公开说这些，尤其是在高考招生的关键时期。但如果没人批评她，让她整日沉浸在近代第一所大学的""美誉""中，她会好起来吗？",603,2.851695423355949e-06,知乎治校指日可待，上热搜之前无领导关心，出现申请石沉大海，上热搜之后连夜改政策…… 知乎人人都可发声(匿名便可回答)，社会普遍参与，倒逼学校重视。建议以此制度取代学代会，只是辛苦了app开发人员连夜改程序 原回答：看到呆了6年的母校又双叒上了热搜，我……十分的欣慰 又有人关注她了题归正转，以后谁要再敢说工科院校缺乏人文关怀，老子就……就以天大为例狠狠赞同TA 举个栗子：我们实验室在北洋科学楼，因学院和物业协商不一致，物业拒绝给3楼以上供水，就是那种洗个手上个厕所得跑一楼那种。我们辛辛苦苦从一楼打水到实验室搞卫生，脏水还不能从下水道倒……因为楼下的水管破了……我们让他们叫物业来修。过了一周多，我们以为楼下怎么着也得修好了吧，就把涮完抹布的水往下倒，你猜怎么着，楼下又找上来了……在这里为中航物业点个大大的赞，让我们既不能接水又不能倒水再举个栗子：一次去学五食堂吃饭，门口例常扫码给大爷看。,3.997446818004846e-11
