name,gender,follower_count,voteup,cmt_count,content,character_num,emotion1,relief,re1
匿名用户,1,0,8905,567,没想到睡前一个抖机灵的回答竟然能火，知乎小透明倍感荣幸。其实我真的觉得这个回答没有什么水平，难道真的是我太能阴阳怪气了（捂脸）随着这个问题的热度越来越高，几个问题还是要解释一下，首先天大和南开一直都是一种相爱相杀的关系，天大的学生喜欢在网上黑南开，南开也经常黑天大，就这样。然后在屏幕对面，很多人都会把我们的感情给放大，你觉得我们现在都是义愤填膺，慷慨激昂，现在学校不让我们出去我们就要起义一样。可实际上，我也只是在吃饭拥挤的时候吐槽了几句，在学校把我头发剪坏的时候骂了几句，然后晚上睡前看到这个问题发点牢骚，抖个机灵。大部分时候我们还是还干嘛就干嘛的。这么多年学上下来，对学校的一些骚操作也都习以为常了，这种讽刺的话我以前也说过很多（难道我从小就是个阴阳师，捂脸），唯一不同的是这一次的回答火了。我觉得我只是在发牢骚罢了，可看到这个问题的人并不这样想，怕了怕了，匿了匿了。以下为原答案泻药，人在天大，刚下实验室。南开虽然已经解封，但南开毕竟只是一个普通的985，而天大是于1895建立的中国第一所高校，那能一样吗？考虑到很多同学平时在实验室做实验长期久坐不运动，担心同学的身体出现问题，学校在7月16号安排研一和大三的部分同学返校后又关闭了几个食堂，为的就是能够让学生能在三十六七度的中午多晒一会太阳，增强学生的体质。很多同学现在陷入了消费主意的陷阱中，总是喜欢买买买，于是学校就把快递点安排在了学校门口，增加取快递的难度，与此同时只留下个别超市晚上八点前关门，大大降低了学生的购买欲望，为学生减少开支。可能有的同学因为生病或者其他原因必须要出校门，这时候，学校繁琐的登记申请流程让你在没有走出校门时就可以感受到社会上办理业务的困难，让你提前感受社会的艰辛。一些已经结婚的博士生被困在学校中，不得不与亲人分离，这是为了让距离产生美，让彼此都更能感受到对方的重要，从而增进彼此的感情。外卖大多都是些垃圾食品，将外卖配送点安排在校门口，很大程度上减少了学生点外卖的频率，就算是非要点外卖也可以增加一些你的运动量，从而让你更加健康。所以，学校不让你出去是为了保护你；不开食堂是为了锻炼你；申请离校是为了考验你。学校的每一步操作都充分体现着人文主义关怀，为什么你们这群学生只知道抱怨？太让我伤心了。,946,1.0,其实我真的觉得这个回答没有什么水平，难道真的是我太能阴阳怪气了（捂脸）随着这个问题的热度越来越高，几个问题还是要解释一下，首先天大和南开一直都是一种相爱相杀的关系，天大的学生喜欢在网上黑南开，南开也经常黑天大，就这样。然后在屏幕对面，很多人都会把我们的感情给放大，你觉得我们现在都是义愤填膺，慷慨激昂，现在学校不让我们出去我们就要起义一样。可实际上，我也只是在吃饭拥挤的时候吐槽了几句，在学校把我头发剪坏的时候骂了几句，然后晚上睡前看到这个问题发点牢骚，抖个机灵。考虑到很多同学平时在实验室做实验长期久坐不运动，担心同学的身体出现问题，学校在7月16号安排研一和大三的部分同学返校后又关闭了几个食堂，为的就是能够让学生能在三十六七度的中午多晒一会太阳，增强学生的体质。很多同学现在陷入了消费主意的陷阱中，总是喜欢买买买，于是学校就把快递点安排在了学校门口，增加取快递的难度，与此同时只留下个别超市晚上八点前关门，大大降低了学生的购买欲望，为学生减少开支。,0.999999997588608
痞儒,1,135,2567,142,好消息，学校方面已于今日（19日）发布了最新的政策。如何认识这一次的“知乎治校”呢？我认为这是天大学生通过舆论改造世界的一次成功尝试。以前有一些尝试失败了，但是这一次成功了，说明“斗争，失败，再斗争，再失败，直到成功。”的实践规律是起作用的。在这样的规律指导下，当代青年，甚至是当代无产阶级，世界上任何被压迫的人都不能够放弃斗争，太阳终究照常升起。母校的回应还是非常迅速的，必须给疫情防控领导小组的各位领导们点赞！感谢你们！赋予学生一定的进出校自由，这是核心的诉求，但不是唯一的诉求。学生的诉求还包括：1.要求疏通、完善校内的学生参与学校民主管理的通道。“知乎治校”不是长久之计，学校的管理事务由学校内部协商解决即可。但是必须得保证校内的多方民主管理渠道畅通，有效。具体来看，可以是改组学生委员会，改革学生代表大会制度等方法。同时，同学们对学校管理的高度关注和参与也十分重要，主人翁意识要强烈，千万不能以为来学校就只是来读书的。2.要求上级纪委或学校同级纪委调查学校领导、相关部门是否有私授特权现象，是否有以权谋私的现象。如果有，则要求纪委部门按党纪国法处理，全面从严治党要落实群众监督。3.要求提高校内生活服务质量和后勤保障。提高是一个过程，学校不可能立即满足同学们的要求，因此需要加时限。如要求2022年前取消空调押金制度，积压的小绿车押金需在2021年前全部退还，且2021年及以后的小绿车押金退还应在当日内到账。如要求食堂提高平价荤素菜的供应量，平价荤菜不得超过五元一份，平价素菜不得超过两元一份。4.要求解释研究生（硕博）补助问题。这个问题很多硕博的同学在提，大概是补助较少，认为不符合国家相关规定。具体有什么诉求，还得请硕博同学补充。这些诉求要得到解决，需要长期斗争和监督，如果群众自动放弃，那将永远得不到解决。看到很多答主说完结撒花，你们呐...以下是一答。本人天大16级学生，刚刚毕业，回家有一段时间，看到这个问题在同学们之间讨论比较热烈，发表一点意见。一、该不该公开讨论学校行政的问题《天津大学章程》第一章 第九条规定，学校实行中国共产党天津大学委员会领导下的校长负责制，推进教授治学，民主管理，建立健全师生参与、专家咨询和集体决策相结合的机制。《天津大学章程》第三章 学生 第十九条 规定了学生的基本权利，其中第五条指出，学生具有“参与学校管理，知悉学校改革、建设和发展情况，知悉涉及切身利益的重大事项”的权利。《天津大学章程》第六章 第三节 民主管理制度 的第五十二条规定：学校坚持民主管理，建立民主协商机制，支持和保障师生员工参与学校决策、执行和监督，依靠师生员工推动事业发展。看到这里，我们可以得出结论，如果《天津大学章程》能够得到天津大学师生、天津大学行政机构、社会公众、上级党委的一致认可，即这玩意确实是有用的，那么上述几条就应该能够保证各位同学对学校的决策有充分的参与权，如果决策过程中出现问题，那么也有充分的监督权。同学们在这里讨论“学校是否应该继续封闭校园”以及“学校在封闭校园的过程中出现的特权现象”的讨论，实际上就是在行使自己的监督权利。如果我上面引用的没错，如果《天津大学章程》真的有用，那么各位不用担心自己被查水表，或者是被延毕。我们都是为了母校好。二、学生行使上述权利的基本形式，以及所谓的“知乎治校”《天津大学章程》第六章 第三节 民主管理制度 的第五十四条规定：学生代表大会是全体学生行使民主权利、参与学校民主管理和民主监督的基本形式，是学校联系学生的重要纽带。其主要职权是：…（三）代表全体学生参与涉及学生的学校事务民主管理，听取学校工作报告，讨论学生培养总体方案、学位授予办法、学生奖惩办法、奖学金评定方案等涉及全校学生切身利益的重大事项，提出意见和建议，维护学生的正当权益。…学生代表大会选举产生学生委员会，在学生代表大会闭会期间代表全体学生行使前款职权。总之，同学们如果想要行使自己的基本权利，那么在现在应该借助于学生委员会这个机构。为什么会产生一种“知乎治校”的错觉呢？其原因恰恰就在于这个机构实际上并不是学生行使权利的渠道，它“失声”了。因此才会有大量的学生在知乎上发表本应当由学生委员会听取的意见。这也说明，我校学生参与学校民主管理的形式还有待改善。但是真的会改善吗？我个人觉得不会，所以，学生知乎治校，好！学生委员会治校，不好！三、官僚主义与特权官僚主义是脱离群众的体现，是与中国共产党“为人民服务”的宗旨相违背的。校园官僚主义是官僚主义在大学校园的体现。校园虽然有一定的生产资料，如土地，但校园不可能在自己的土地上从事生产活动，因此，校园内生活资料的供给完全依赖于校园外的社会。这种经济上的依赖关系决定了政治上的依赖关系，并且产生了独特的社会意识。这是任何批判校园官僚主义的人必须明白的，如果一个人只想通过校园内部的改革解决校园官僚主义，那么他一定会失败。如果我们要谈官僚主义而不是校园官僚主义，那这个问题就太复杂了，并且非常敏感。总之，结论是官僚主义在当下的历史条件下是不可能消除的，如果要消除，那么一个必要条件是人民群众当家做主的意识、在政治上觉醒的程度是空前的高。这次我看到了我很多平时并不关注政治的同学也在发声，我认为是好事。虽然这种发声带着些许的情绪，但是坚持下去一定能够闪耀理性的光辉。如果年轻的时候不问政事，那么中年时又如何来管理好这个国家呢？青年们对于国家大事、学校大事的关注是值得鼓励的，青年们永远是社会进步的代表，因为年轻人是国家的未来。关于特权，在这里我只想简单讨论一下苏联亡党亡国的教训。苏共20大之后，苏共就不再是苏共，而是苏修。苏修建立起了一套庞大的官僚特权体系，后来引进了我国，但毛主席本人是非常不喜欢这种等级制的，他本人也在摸索。苏修的官僚们是所谓的国家生产资料的管理者，只在公有制条件下对生产资料进行管理。但是，缺乏民主监督的“管理”最终演变成了特权，苏修的官僚们再也不想被什么社会主义和共产主义的制度束缚了，于是走了私有化的道路，名正言顺地据有了人民的财产。我个人认为，这套庞大的官僚特权体系是建立在列宁的“先锋队”理论之上的。列宁认为共产党要在白色恐怖中进行武装斗争，建立无产阶级专政的国家，那就必须要建立一个无产阶级的先锋队，这个先锋队作战勇猛，纪律严明，能够起到很好的示范作用。但是无产阶级夺得政权以后，先锋队理论是否仍然正确，这恐怕就要打一个问号了。四、流官现象天大校长换的太勤，这不是什么好事，在学生看来有“流官”的嫌疑也十分正常。学生们一面对新来的校长充满期待，一面又对频繁换校长感到不满。这是学生关心学校发展，希望学校发展的好的强烈体现。学生没有权利决定校长的人事任免，副部级的人事任免由中央组织部决定。不管“流官”现象是否在天大存在，我们都希望每一任校长都能把天大建设好。怎么建设？根本的方法还是要发动人民群众，也就是发动学生，这是我们党的三大法宝之一，也是老路线，老传统了。五、关于母校在这件事的讨论中，我们应该防止出现两个极端。一个是全盘否定天大的行政管理，另一个是禁止任何对母校的批评。行政管理是非常复杂的系统，我希望同学们对母校有一定的包容心，同时也不要玻璃心。在这件事上，我认为学生至少有以下两点诉求：1.要求疏通、健全学生参与学校民主管理的渠道，要求学校行政的决策结果和过程接受学生有效监督，依法治校。2.学校党委应将学生出校的诉求纳入学校党委常务委员会的讨论议程内，参考其他高校，综合研判当前我校和我市疫情控制的形势，满足学生合理出校的需求。不在天大，只能为在校的同学做一点微小的贡献，大家说吼不吼啊？青年学生要关心国家大事。——毛泽东，1966年6月。,3144,1.0,学生的诉求还包括：1.要求疏通、完善校内的学生参与学校民主管理的通道。一、该不该公开讨论学校行政的问题《天津大学章程》第一章 第九条规定，学校实行中国共产党天津大学委员会领导下的校长负责制，推进教授治学，民主管理，建立健全师生参与、专家咨询和集体决策相结合的机制。《天津大学章程》第三章 学生 第十九条 规定了学生的基本权利，其中第五条指出，学生具有“参与学校管理，知悉学校改革、建设和发展情况，知悉涉及切身利益的重大事项”的权利。《天津大学章程》第六章 第三节 民主管理制度 的第五十二条规定：学校坚持民主管理，建立民主协商机制，支持和保障师生员工参与学校决策、执行和监督，依靠师生员工推动事业发展。看到这里，我们可以得出结论，如果《天津大学章程》能够得到天津大学师生、天津大学行政机构、社会公众、上级党委的一致认可，即这玩意确实是有用的，那么上述几条就应该能够保证各位同学对学校的决策有充分的参与权，如果决策过程中出现问题，那么也有充分的监督权。二、学生行使上述权利的基本形式，以及所谓的“知乎治校”《天津大学章程》第六章 第三节 民主管理制度 的第五十四条规定：学生代表大会是全体学生行使民主权利、参与学校民主管理和民主监督的基本形式，是学校联系学生的重要纽带。其主要职权是：…（三）代表全体学生参与涉及学生的学校事务民主管理，听取学校工作报告，讨论学生培养总体方案、学位授予办法、学生奖惩办法、奖学金评定方案等涉及全校学生切身利益的重大事项，提出意见和建议，维护学生的正当权益。,1.0
牛先生,1,192,637,131,"7.19日午更新。好消息，现在已经官方通知可以通过天津大学综合服务app申请离校了，并且能够立即办结出校。大家出校还是要自觉遵守出校承诺书，注意防护，带上口罩啊说实话之前我对学校迫于舆论改变措施并不抱有希望，因此这个结果如此迅速地出现也是让我十分惊喜的。不管这个结果是热搜带来的，还是传闻中的“学校早有计划”，我想大部分在校生都会对学校的这个决定表示欢迎。我认为学校这次转变值得点赞 在我看来“如何看待天津大学仍然不让学生出校门？”这个问题已经结束。当然，疫情远未结束，学校管理能力的进步远未结束，学生还有更多的合理诉求需要被满足。我觉得把学校的问题和学生的痛点摆在互联网平台上讨论是个好方式。当然问题下也有些回答和评论以偏概全，还需要辨证看待。最后再放上今天校长信箱的回复，真没想到有回复。我问了跟我一起发的小伙伴，他们也都收到了，回复是统一的。我希望天大越来越好。——————————————————————7.18日更新。看了下最新的几个回答，已经有一些其他高校的同学也开始表达同样的问题。可能有人会说，现在全国高校都差不多，大部分都被关着。这样好像显得我们天大学生无理取闹了。想到这里我还是想要再补充我的看法。首先，这个问题虽然是在一天之内热起来的，但天大学校行政管理水平的不足，人文关怀的缺失，食堂空调网费等等的不合理不是一天两天了，这才是大家把积压的不满的根源。 “出校门”只是引爆这轮口诛笔伐的导火索。其次，看看大家切身的经验，学校所谓的疫情防控封闭管理漏洞百出。光今天中午从26教走到学三就看到俩小孩。 严格限制学生，教职工却可以带孩子来玩，附近社区居民却进出校医院看病，竟然还有三四家新的餐饮店开进学校？这让我们对为什么还要被关在学校里打上大大大大大大的问号。再次，回到该不该“出校门”问题，虽然回答下面一片倒都要求“学隔壁，要出去”。但知乎热榜对这个问题总结是“引发争议”，这确实是个争议，并且事关国家常态化防疫的具体落实。但这个争议需要更多人的智慧与声音。随着越来越多“非天大”“利益无关”者听到我们的呼声，这个问题逐渐会变成“国内高校该不该让学生出校”的类似问题。我的观点仍然是，目前天大封校管理刚性一刀切的做法已经远远滞后于天津市疫情发展现状了。最后，更多的高校仍然采取完全封闭的措施不代表天津市高校，不代表天大需要采取完全封闭的措施（实事求是地说说到这里，又瞧瞧隔壁，为什么隔壁领导圈能做出学生可以当日出校返校的决定，难道仅仅是校长爱生如子？没有衡量过风险？一些其他高校学生的回答也提出了自己学校封闭管理的明显漏洞与不合理处，所以这些矛盾的，不合理的现象也不只有天大。希望天大学生的这波呼声不仅能让我校的领导团队听见,促使他们往更加人性化的管理方向改变，还能引起更多的“非天大”，“利益无关”的学生，甚至其他高校共同思考与讨论如何优化广大低风险地区高校常态化防疫的措施。———————————————————————再经评论区提醒：校长信箱应该没有鸟用。我自己是上午发了封邮件，不过看现在这个热度也校方应该已经知道了。太神奇了，昨天中午我在攥写回答的时候才5、6个回答，现在竟然热榜第二了，震惊。———————————————————————感谢评论区提醒，校长信箱：president@tju.edu.cn看了不少回答，大家群情激愤情有可原，但也不要放弃沟通，不管结果如何，可以先发封邮件表达诉求。———————————————————————昨天和前天又返校一波学生，封闭学生人数增加一倍以上，现在看来学校对此没有做好充足的准备，今天中午食堂已经挤爆，同学们正午在30℃+的气温下在食堂门口排队等待。目前天大只有学三和学五两个食堂开放，而这两个食堂仍采取“安全距离”方式限制用餐位置，学生叫苦不迭。我认为学校现在仍然采取封校措施，显然不符合天津市疫情发展的现状，属于过度。希望校领导还记得我们的校训：实事求是。达到学三食堂规定容量上限，工作人员拦住不让进，只能等里面同学吃完，出来一个进去一个等待进入学三的长队https://www.zhihu.com/video/1267466498458726400学五食堂只开放二层，大量座位被绑上绳子，一桌一人。大量座位被空出https://www.zhihu.com/video/1267467190695268352",1797,1.0,"大家出校还是要自觉遵守出校承诺书，注意防护，带上口罩啊说实话之前我对学校迫于舆论改变措施并不抱有希望，因此这个结果如此迅速地出现也是让我十分惊喜的。我认为学校这次转变值得点赞 在我看来“如何看待天津大学仍然不让学生出校门？当然，疫情远未结束，学校管理能力的进步远未结束，学生还有更多的合理诉求需要被满足。看了下最新的几个回答，已经有一些其他高校的同学也开始表达同样的问题。最后，更多的高校仍然采取完全封闭的措施不代表天津市高校，不代表天大需要采取完全封闭的措施（实事求是地说说到这里，又瞧瞧隔壁，为什么隔壁领导圈能做出学生可以当日出校返校的决定，难道仅仅是校长爱生如子？希望天大学生的这波呼声不仅能让我校的领导团队听见,促使他们往更加人性化的管理方向改变，还能引起更多的“非天大”，“利益无关”的学生，甚至其他高校共同思考与讨论如何优化广大低风险地区高校常态化防疫的措施。———————————————————————昨天和前天又返校一波学生，封闭学生人数增加一倍以上，现在看来学校对此没有做好充足的准备，今天中午食堂已经挤爆，同学们正午在30℃+的气温下在食堂门口排队等待。",0.9999999999999509
